{
  "$schema": "https://json-schema.org/draft/2020-12/schema",
  "type": "object",
  "additionalProperties": false,
  "required": [
    "apiVersion",
    "authenticationProfile",
    "repository",
    "baseline",
    "baselineDigest",
    "candidateBinding",
    "sourceDigest",
    "scope",
    "snapshot",
    "trace",
    "architectureReferences"
  ],
  "properties": {
    "apiVersion": {
      "const": "specguard.architecture-handoff/v1alpha1"
    },
    "authenticationProfile": {
      "const": "fixture-only"
    },
    "repository": {
      "type": "string"
    },
    "baseline": {
      "$ref": "#/$defs/ApprovedBaseline"
    },
    "baselineDigest": {
      "type": "string"
    },
    "candidateBinding": {
      "$ref": "#/$defs/CandidateBinding"
    },
    "sourceDigest": {
      "type": "string"
    },
    "scope": {
      "type": "array",
      "items": {
        "$ref": "#/$defs/Identity"
      },
      "minItems": 1,
      "maxItems": 256
    },
    "snapshot": {
      "$ref": "#/$defs/SourceSnapshot"
    },
    "trace": {
      "$ref": "#/$defs/TraceArtifact"
    },
    "architectureReferences": {
      "type": "array",
      "items": {
        "$ref": "#/$defs/ArchitectureReference"
      }
    }
  },
  "$defs": {
    "Identity": {
      "type": "object",
      "additionalProperties": false,
      "required": [
        "namespace",
        "id"
      ],
      "properties": {
        "namespace": {
          "type": "string"
        },
        "id": {
          "type": "string"
        }
      }
    },
    "SourceRef": {
      "type": "object",
      "additionalProperties": false,
      "required": [
        "path",
        "line"
      ],
      "properties": {
        "path": {
          "type": "string"
        },
        "line": {
          "type": "integer",
          "minimum": 0
        }
      }
    },
    "SourceStatus": {
      "type": "object",
      "additionalProperties": false,
      "required": [
        "path",
        "status",
        "reason"
      ],
      "properties": {
        "path": {
          "type": "string"
        },
        "status": {
          "enum": [
            "complete",
            "unsupported",
            "malformed",
            "limit",
            "io_error",
            "conflict"
          ]
        },
        "reason": {
          "type": "string"
        }
      }
    },
    "Requirement": {
      "type": "object",
      "additionalProperties": false,
      "required": [
        "key",
        "text",
        "source"
      ],
      "properties": {
        "key": {
          "$ref": "#/$defs/Identity"
        },
        "text": {
          "type": "string"
        },
        "source": {
          "$ref": "#/$defs/SourceRef"
        }
      }
    },
    "Acceptance": {
      "type": "object",
      "additionalProperties": false,
      "required": [
        "key",
        "requirement",
        "text",
        "source"
      ],
      "properties": {
        "key": {
          "$ref": "#/$defs/Identity"
        },
        "requirement": {
          "$ref": "#/$defs/Identity"
        },
        "text": {
          "type": "string"
        },
        "source": {
          "$ref": "#/$defs/SourceRef"
        }
      }
    },
    "TraceEdge": {
      "type": "object",
      "additionalProperties": false,
      "required": [
        "from",
        "to",
        "relation",
        "source"
      ],
      "properties": {
        "from": {
          "$ref": "#/$defs/Identity"
        },
        "to": {
          "$ref": "#/$defs/Identity"
        },
        "relation": {
          "enum": [
            "depends_on",
            "traces_to_adr",
            "traces_to_task"
          ]
        },
        "source": {
          "$ref": "#/$defs/SourceRef"
        }
      }
    },
    "ParseResult": {
      "type": "object",
      "additionalProperties": false,
      "required": [
        "apiVersion",
        "snapshotDigest",
        "candidateOid",
        "sources",
        "requirements",
        "acceptances",
        "edges"
      ],
      "properties": {
        "apiVersion": {
          "const": "specguard.domain/v1alpha1"
        },
        "snapshotDigest": {
          "type": "string"
        },
        "candidateOid": {
          "type": "string"
        },
        "sources": {
          "type": "array",
          "items": {
            "$ref": "#/$defs/SourceStatus"
          }
        },
        "requirements": {
          "type": "array",
          "items": {
            "$ref": "#/$defs/Requirement"
          }
        },
        "acceptances": {
          "type": "array",
          "items": {
            "$ref": "#/$defs/Acceptance"
          }
        },
        "edges": {
          "type": "array",
          "items": {
            "$ref": "#/$defs/TraceEdge"
          }
        }
      }
    },
    "SpecificationGraph": {
      "type": "object",
      "additionalProperties": false,
      "required": [
        "parsed"
      ],
      "properties": {
        "parsed": {
          "$ref": "#/$defs/ParseResult"
        }
      }
    },
    "Limits": {
      "type": "object",
      "additionalProperties": false,
      "required": [
        "maxFiles",
        "maxBytes",
        "maxLines",
        "maxDepth",
        "maxMillis"
      ],
      "properties": {
        "maxFiles": {
          "type": "integer",
          "minimum": 0
        },
        "maxBytes": {
          "type": "integer",
          "minimum": 0
        },
        "maxLines": {
          "type": "integer",
          "minimum": 0
        },
        "maxDepth": {
          "type": "integer",
          "minimum": 0
        },
        "maxMillis": {
          "type": "integer",
          "minimum": 0
        }
      }
    },
    "SourceEntry": {
      "type": "object",
      "additionalProperties": false,
      "required": [
        "path",
        "format",
        "namespace",
        "digest"
      ],
      "properties": {
        "path": {
          "type": "string"
        },
        "format": {
          "type": "string"
        },
        "namespace": {
          "type": "string"
        },
        "digest": {
          "type": "string"
        }
      }
    },
    "SourceInventory": {
      "type": "object",
      "additionalProperties": false,
      "required": [
        "apiVersion",
        "entries",
        "sources",
        "limits"
      ],
      "properties": {
        "apiVersion": {
          "const": "specguard.domain/v1alpha1"
        },
        "entries": {
          "type": "array",
          "items": {
            "$ref": "#/$defs/SourceEntry"
          }
        },
        "sources": {
          "type": "array",
          "items": {
            "$ref": "#/$defs/SourceStatus"
          }
        },
        "limits": {
          "$ref": "#/$defs/Limits"
        }
      }
    },
    "CandidateBinding": {
      "type": "object",
      "additionalProperties": false,
      "required": [
        "candidateOid",
        "baseOid",
        "objectFormat"
      ],
      "properties": {
        "candidateOid": {
          "type": "string"
        },
        "baseOid": {
          "type": "string"
        },
        "objectFormat": {
          "type": "string"
        }
      }
    },
    "SourceSnapshot": {
      "type": "object",
      "additionalProperties": false,
      "required": [
        "apiVersion",
        "inventory",
        "binding",
        "contents",
        "digest"
      ],
      "properties": {
        "apiVersion": {
          "const": "specguard.domain/v1alpha1"
        },
        "inventory": {
          "$ref": "#/$defs/SourceInventory"
        },
        "binding": {
          "$ref": "#/$defs/CandidateBinding"
        },
        "contents": {
          "type": "object",
          "additionalProperties": {
            "type": "array",
            "items": {
              "type": "integer",
              "minimum": 0,
              "maximum": 255
            }
          }
        },
        "digest": {
          "type": "string"
        }
      }
    },
    "ApprovedBaseline": {
      "type": "object",
      "additionalProperties": false,
      "required": [
        "apiVersion",
        "repository",
        "scope",
        "sourceRevision",
        "sourceDigest",
        "graphDigest",
        "policyDigest",
        "approvalRef",
        "effectiveFrom",
        "expiresAt",
        "state",
        "graph"
      ],
      "properties": {
        "apiVersion": {
          "const": "specguard.domain/v1alpha1"
        },
        "repository": {
          "type": "string"
        },
        "scope": {
          "type": "array",
          "items": {
            "$ref": "#/$defs/Identity"
          }
        },
        "sourceRevision": {
          "type": "string"
        },
        "sourceDigest": {
          "type": "string"
        },
        "graphDigest": {
          "type": "string"
        },
        "policyDigest": {
          "type": "string"
        },
        "approvalRef": {
          "type": "string"
        },
        "effectiveFrom": {
          "type": "integer"
        },
        "expiresAt": {
          "type": "integer"
        },
        "state": {
          "enum": [
            "proposed",
            "approved",
            "superseded",
            "expired",
            "revoked"
          ]
        },
        "graph": {
          "$ref": "#/$defs/SpecificationGraph"
        }
      }
    },
    "TestObligation": {
      "type": "object",
      "additionalProperties": false,
      "required": [
        "id",
        "requirement",
        "acceptance",
        "source",
        "textDigest",
        "links"
      ],
      "properties": {
        "id": {
          "type": "string"
        },
        "requirement": {
          "$ref": "#/$defs/Identity"
        },
        "acceptance": {
          "$ref": "#/$defs/Identity"
        },
        "source": {
          "$ref": "#/$defs/SourceRef"
        },
        "textDigest": {
          "type": "string"
        },
        "links": {
          "type": "array",
          "items": {
            "$ref": "#/$defs/TraceEdge"
          }
        }
      }
    },
    "ObligationSet": {
      "type": "object",
      "additionalProperties": false,
      "required": [
        "apiVersion",
        "kind",
        "baselineDigest",
        "sourceDigest",
        "candidateOid",
        "scope",
        "sources",
        "complete",
        "authenticationProfile",
        "obligations"
      ],
      "properties": {
        "apiVersion": {
          "const": "specguard.domain/v1alpha1"
        },
        "kind": {
          "const": "TestObligationSet"
        },
        "baselineDigest": {
          "type": "string"
        },
        "sourceDigest": {
          "type": "string"
        },
        "candidateOid": {
          "type": "string"
        },
        "scope": {
          "type": "array",
          "items": {
            "$ref": "#/$defs/Identity"
          }
        },
        "sources": {
          "type": "array",
          "items": {
            "$ref": "#/$defs/SourceStatus"
          }
        },
        "complete": {
          "type": "boolean"
        },
        "authenticationProfile": {
          "type": "string"
        },
        "obligations": {
          "type": "array",
          "items": {
            "$ref": "#/$defs/TestObligation"
          }
        }
      }
    },
    "TraceTarget": {
      "type": "object",
      "additionalProperties": false,
      "required": [
        "key",
        "kind",
        "source"
      ],
      "properties": {
        "key": {
          "$ref": "#/$defs/Identity"
        },
        "kind": {
          "enum": [
            "adr",
            "task"
          ]
        },
        "source": {
          "$ref": "#/$defs/SourceRef"
        }
      }
    },
    "TraceTargets": {
      "type": "object",
      "additionalProperties": false,
      "required": [
        "nodes",
        "sources"
      ],
      "properties": {
        "nodes": {
          "type": "array",
          "items": {
            "$ref": "#/$defs/TraceTarget"
          }
        },
        "sources": {
          "type": "array",
          "items": {
            "$ref": "#/$defs/SourceStatus"
          }
        }
      }
    },
    "TypedSpecificationGraph": {
      "type": "object",
      "additionalProperties": false,
      "required": [
        "graph",
        "targets"
      ],
      "properties": {
        "graph": {
          "$ref": "#/$defs/SpecificationGraph"
        },
        "targets": {
          "$ref": "#/$defs/TraceTargets"
        }
      }
    },
    "Finding": {
      "type": "object",
      "additionalProperties": false,
      "required": [
        "kind",
        "key",
        "sources"
      ],
      "properties": {
        "kind": {
          "enum": [
            "duplicate",
            "missing_requirement",
            "missing_acceptance",
            "broken_reference",
            "incomplete",
            "tool_error"
          ]
        },
        "key": {
          "$ref": "#/$defs/Identity"
        },
        "sources": {
          "type": "array",
          "items": {
            "$ref": "#/$defs/SourceRef"
          }
        }
      }
    },
    "TraceArtifact": {
      "type": "object",
      "additionalProperties": false,
      "required": [
        "apiVersion",
        "graph",
        "required",
        "findings"
      ],
      "properties": {
        "apiVersion": {
          "const": "specguard.trace/v1alpha1"
        },
        "graph": {
          "$ref": "#/$defs/TypedSpecificationGraph"
        },
        "required": {
          "type": "array",
          "items": {
            "$ref": "#/$defs/Identity"
          },
          "minItems": 1
        },
        "findings": {
          "type": "array",
          "items": {
            "$ref": "#/$defs/Finding"
          }
        }
      }
    },
    "ArchitectureReference": {
      "type": "object",
      "additionalProperties": false,
      "required": [
        "requirement",
        "requirementSource",
        "adr",
        "adrSource",
        "relationSource"
      ],
      "properties": {
        "requirement": {
          "$ref": "#/$defs/Identity"
        },
        "requirementSource": {
          "$ref": "#/$defs/SourceRef"
        },
        "adr": {
          "$ref": "#/$defs/Identity"
        },
        "adrSource": {
          "$ref": "#/$defs/SourceRef"
        },
        "relationSource": {
          "$ref": "#/$defs/SourceRef"
        }
      }
    }
  }
}
