{"apiVersion":"specguard.architecture-handoff/v1alpha1","authenticationProfile":"fixture-only","repository":"fixture-repo","baseline":{"apiVersion":"specguard.domain/v1alpha1","repository":"fixture-repo","scope":[{"namespace":"demo","id":"R1"}],"sourceRevision":"2222222222222222222222222222222222222222","sourceDigest":"sha256:1111111111111111111111111111111111111111111111111111111111111111","graphDigest":"sha256:0ac8dd48c6029297ba1e18257d95364cbea9c379853e7e52ba4be7cae7a7b7a8","policyDigest":"sha256:aaaaaaaaaaaaaaaaaaaaaaaaaaaaaaaaaaaaaaaaaaaaaaaaaaaaaaaaaaaaaaaa","approvalRef":"fixture:approval-1","effectiveFrom":10,"expiresAt":100,"state":"approved","graph":{"parsed":{"apiVersion":"specguard.domain/v1alpha1","snapshotDigest":"sha256:1111111111111111111111111111111111111111111111111111111111111111","candidateOid":"2222222222222222222222222222222222222222","sources":[{"path":"specs/a.md","status":"complete","reason":"parsed"}],"requirements":[{"key":{"namespace":"demo","id":"R1"},"text":"A user can sign in.","source":{"path":"specs/a.md","line":5}}],"acceptances":[{"key":{"namespace":"demo","id":"A1"},"requirement":{"namespace":"demo","id":"R1"},"text":"A correct password opens a session.","source":{"path":"specs/a.md","line":7}}],"edges":[]}}},"baselineDigest":"sha256:82b804c9a61cb334cdc1504decf4bdfde09dd35a7fd795627d79c48940369e91","candidateBinding":{"candidateOid":"edc40f7ae3dcf2ad9dfb400a1d0b3598c87c16e8","baseOid":"edc40f7ae3dcf2ad9dfb400a1d0b3598c87c16e8","objectFormat":"sha1"},"sourceDigest":"sha256:bcf8d9b603f18dd624098b034432e953b37b9140689beb87f9d28e3d3833966f","scope":[{"namespace":"demo","id":"R1"}],"snapshot":{"apiVersion":"specguard.domain/v1alpha1","inventory":{"apiVersion":"specguard.domain/v1alpha1","entries":[{"path":"adr.md","format":"markdown-adr/v1","namespace":"demo","digest":"sha256:09f24c5ab5241ca060276b7ddc9e15405e02b56a5571ea79dac84fbc044a59cd"},{"path":"specs/a.md","format":"markdown-explicit/v1","namespace":"demo","digest":"sha256:162436d3be5d48be3569d5cc89ae98c4e6a7f02de5774e35f8fb1baf60becd8a"},{"path":"tasks.md","format":"markdown-task/v1","namespace":"demo","digest":"sha256:52aa1e5c76e7d0436e0a65d174e1c381cc17dcb68b193593e0b96be0ee4ce363"}],"sources":[{"path":"adr.md","status":"complete","reason":"discovered"},{"path":"specs/a.md","status":"complete","reason":"discovered"},{"path":"tasks.md","status":"complete","reason":"discovered"}],"limits":{"maxFiles":1000,"maxBytes":1048576,"maxLines":10000,"maxDepth":16,"maxMillis":5000}},"binding":{"candidateOid":"edc40f7ae3dcf2ad9dfb400a1d0b3598c87c16e8","baseOid":"edc40f7ae3dcf2ad9dfb400a1d0b3598c87c16e8","objectFormat":"sha1"},"contents":{"adr.md":[45,45,45,10,102,111,114,109,97,116,58,32,109,97,114,107,100,111,119,110,45,97,100,114,47,118,49,10,110,97,109,101,115,112,97,99,101,58,32,100,101,109,111,10,45,45,45,10,35,35,32,65,68,82,58,32,65,68,82,49,10,85,115,101,32,116,104,101,32,115,112,101,99,105,102,105,101,100,32,100,101,115,105,103,110,46,10],"specs/a.md":[45,45,45,10,102,111,114,109,97,116,58,32,109,97,114,107,100,111,119,110,45,101,120,112,108,105,99,105,116,47,118,49,10,110,97,109,101,115,112,97,99,101,58,32,100,101,109,111,10,45,45,45,10,35,35,32,82,101,113,117,105,114,101,109,101,110,116,58,32,82,49,10,65,32,117,115,101,114,32,99,97,110,32,115,105,103,110,32,105,110,46,10,35,35,35,32,65,99,99,101,112,116,97,110,99,101,58,32,65,49,10,65,32,99,111,114,114,101,99,116,32,112,97,115,115,119,111,114,100,32,111,112,101,110,115,32,97,32,115,101,115,115,105,111,110,46,10,10,45,32,116,114,97,99,101,115,95,116,111,95,97,100,114,58,32,100,101,109,111,58,65,68,82,49,10,45,32,116,114,97,99,101,115,95,116,111,95,116,97,115,107,58,32,100,101,109,111,58,84,49,10],"tasks.md":[45,45,45,10,102,111,114,109,97,116,58,32,109,97,114,107,100,111,119,110,45,116,97,115,107,47,118,49,10,110,97,109,101,115,112,97,99,101,58,32,100,101,109,111,10,45,45,45,10,35,35,32,84,97,115,107,58,32,84,49,10,73,109,112,108,101,109,101,110,116,32,116,104,101,32,114,101,113,117,105,114,101,109,101,110,116,46,10]},"digest":"sha256:bcf8d9b603f18dd624098b034432e953b37b9140689beb87f9d28e3d3833966f"},"trace":{"apiVersion":"specguard.trace/v1alpha1","graph":{"graph":{"parsed":{"apiVersion":"specguard.domain/v1alpha1","snapshotDigest":"sha256:bcf8d9b603f18dd624098b034432e953b37b9140689beb87f9d28e3d3833966f","candidateOid":"edc40f7ae3dcf2ad9dfb400a1d0b3598c87c16e8","sources":[{"path":"specs/a.md","status":"complete","reason":"parsed"}],"requirements":[{"key":{"namespace":"demo","id":"R1"},"text":"A user can sign in.","source":{"path":"specs/a.md","line":5}}],"acceptances":[{"key":{"namespace":"demo","id":"A1"},"requirement":{"namespace":"demo","id":"R1"},"text":"A correct password opens a session.\n\n- traces_to_adr: demo:ADR1\n- traces_to_task: demo:T1","source":{"path":"specs/a.md","line":7}}],"edges":[{"from":{"namespace":"demo","id":"R1"},"to":{"namespace":"demo","id":"ADR1"},"relation":"traces_to_adr","source":{"path":"specs/a.md","line":10}},{"from":{"namespace":"demo","id":"R1"},"to":{"namespace":"demo","id":"T1"},"relation":"traces_to_task","source":{"path":"specs/a.md","line":11}}]}},"targets":{"nodes":[{"key":{"namespace":"demo","id":"ADR1"},"kind":"adr","source":{"path":"adr.md","line":5}},{"key":{"namespace":"demo","id":"T1"},"kind":"task","source":{"path":"tasks.md","line":5}}],"sources":[{"path":"adr.md","status":"complete","reason":"parsed explicit trace target"},{"path":"tasks.md","status":"complete","reason":"parsed explicit trace target"}]}},"required":[{"namespace":"demo","id":"R1"}],"findings":[]},"architectureReferences":[{"requirement":{"namespace":"demo","id":"R1"},"requirementSource":{"path":"specs/a.md","line":5},"adr":{"namespace":"demo","id":"ADR1"},"adrSource":{"path":"adr.md","line":5},"relationSource":{"path":"specs/a.md","line":10}}]}